<?xml version="1.0" encoding="UTF-8"?>
<competitors xmlns:xsi="http://www.w3.org/2001/XMLSchema-instance"
             xsi:noNamespaceSchemaLocation="decathlonResults.xsd">
    <athlete>
        <place>1</place>
        <personal_data>
            <name>Siim Susi</name>
            <birth>1.01.1976</birth>
            <country>Estonia</country>
        </personal_data>
        <results total_score="4234">
            <result event="100 m sprint" unit="sec">12.61</result>
            <result event="Long jump" unit="m">5.00</result>
            <result event="Shot put" unit="m">9.22</result>
            <result event="High jump" unit="m">1.50</result>
            <result event="400 m sprint" unit="min:sec">59.39</result>
            <result event="110 m hurdles" unit="sec">16.43</result>
            <result event="Discus throw" unit="m">21.60</result>
            <result event="Pole vault" unit="m">2.60</result>
            <result event="Javelin throw" unit="m">35.81</result>
            <result event="1500 m race" unit="min:sec">5:25.72</result>
        </results>
    </athlete>    
    <athlete>
        <place>2</place>
        <personal_data>
            <name>Василий Пупкин</name>
            <birth>21.10.1980</birth>
            <country>Ukraine</country>
        </personal_data>
        <results total_score="3100">
            <result event="100 m sprint" unit="sec">13.43</result>
            <result event="Long jump" unit="m">4.35</result>
            <result event="Shot put" unit="m">8.64</result>
            <result event="High jump" unit="m">1.50</result>
            <result event="400 m sprint" unit="min:sec">1:06.06</result>
            <result event="110 m hurdles" unit="sec">19.05</result>
            <result event="Discus throw" unit="m">24.89</result>
            <result event="Pole vault" unit="m">2.20</result>
            <result event="Javelin throw" unit="m">33.48</result>
            <result event="1500 m race" unit="min:sec">6:51.01</result>
        </results>
    </athlete>
</competitors>